{
  "schemaVersion": "0.2",
  "researchQuestion": "What can be learned from Reddit posts and comments about AI UI/design skills, anti-slop plugins, Codex workflows, and frontend-generation systems without treating community opinion as proof?",
  "proofPolicy": {
    "redditRole": "qualitative hypothesis evidence",
    "implementationRule": "No Reddit-derived behavior is implementable without independent documentation, source-code evidence, reproducible tests, controlled benchmarks, or browser/accessibility evidence."
  },
  "proofReferences": [
    { "id": "P01", "title": "R01 Reddit thread", "kind": "reddit", "source": "https://www.reddit.com/r/ClaudeAI/comments/1s96sae/i_cannot_figure_out_frontend_design_skill/", "status": "context" },
    { "id": "P02", "title": "R02 Reddit thread", "kind": "reddit", "source": "https://www.reddit.com/r/ClaudeAI/comments/1ulgm5l/frontend_design_trying_to_move_away_from_the_ai/", "status": "context" },
    { "id": "P03", "title": "R03 Reddit thread", "kind": "reddit", "source": "https://www.reddit.com/r/codex/comments/1upt5ha/how_do_you_handle_frontendui_work_with_codex/", "status": "context" },
    { "id": "P04", "title": "R04 Reddit thread", "kind": "reddit", "source": "https://www.reddit.com/r/ClaudeAI/comments/1oxn1gj/frontenddesign_skill_is_so_amazing/", "status": "context" },
    { "id": "P05", "title": "R05 Reddit thread and comments", "kind": "reddit", "source": "https://www.reddit.com/r/ClaudeAI/comments/1u9sgj3/unslopui_a_claude_skill_that_flags_and_removes/", "status": "context" },
    { "id": "P06", "title": "R05 linked dataset claim", "kind": "reddit", "source": "https://www.reddit.com/r/ClaudeAI/comments/1u9sgj3/unslopui_a_claude_skill_that_flags_and_removes/", "status": "not-proof" },
    { "id": "P07", "title": "R06 Reddit comparison", "kind": "reddit", "source": "https://www.reddit.com/r/ClaudeAI/comments/1rafmpg/im_rating_every_claude_code_skill_i_can_find/", "status": "context" },
    { "id": "P08", "title": "R07 Reddit workflow discussion", "kind": "reddit", "source": "https://www.reddit.com/r/ClaudeAI/comments/1t3ht2g/claude_code_frontenddesign_skill_always_outputs/", "status": "context" },
    { "id": "P09", "title": "R08 Reddit comparison", "kind": "reddit", "source": "https://www.reddit.com/r/claudeskills/comments/1tqwn42/claude_with_a_frontend_design_skill_vs_without/", "status": "context" },
    { "id": "P10", "title": "R09 Reddit skill share", "kind": "reddit", "source": "https://www.reddit.com/r/ClaudeAI/comments/1p9srou/finally_figured_out_why_claudes_ui_generations/", "status": "context" },
    { "id": "P11", "title": "R10 Reddit workflow discussion", "kind": "reddit", "source": "https://www.reddit.com/r/codex/comments/1t3iihr/can_codex_make_good_uis_with_the_proper_skills/", "status": "context" },
    { "id": "P12", "title": "R11 Reddit workflow discussion", "kind": "reddit", "source": "https://www.reddit.com/r/codex/comments/1rrjzhv/what_codex_skills_are_actually_improving_your_workflow/", "status": "context" },
    { "id": "P13", "title": "R12 Reddit skill share", "kind": "reddit", "source": "https://www.reddit.com/r/codex/comments/1szupli/codex_uiux_design_and_skill/", "status": "context" },
    { "id": "P14", "title": "R13 Reddit workflow discussion", "kind": "reddit", "source": "https://www.reddit.com/r/ClaudeAI/comments/1t24gan/few_months_of_frontenddesign_uiuxpromaxskill/", "status": "context" },
    { "id": "P15", "title": "R14 Reddit skill discussion", "kind": "reddit", "source": "https://www.reddit.com/r/claudeskills/comments/1tu4v6s/made_a_skill_to_stop_claude_code_from_building/", "status": "context" },
    { "id": "P16", "title": "R16 Reddit recommendations", "kind": "reddit", "source": "https://www.reddit.com/r/ClaudeAI/comments/1txvaef/if_you_used_claude_to_build_your_website_which/", "status": "context" },
    { "id": "P17", "title": "R17 Reddit recommendations", "kind": "reddit", "source": "https://www.reddit.com/r/codex/comments/1swbf35/how_to_make_a_nice_uifrontend/", "status": "context" },
    { "id": "P18", "title": "R19 Reddit mobile discussion", "kind": "reddit", "source": "https://www.reddit.com/r/ClaudeAI/comments/1rwu3q/how_can_i_get_claude_to_design_better_mobile_ui/", "status": "context" },
    { "id": "P19", "title": "R20 Reddit Codex plugin discussion", "kind": "reddit", "source": "https://www.reddit.com/r/codex/comments/1tbnfhn/whats_your_favorite_uiux_codex_skill_and_why/", "status": "context" },
    { "id": "P20", "title": "GOV.UK design principles", "kind": "official-standard", "source": "https://www.gov.uk/guidance/government-design-principles", "status": "primary" },
    { "id": "P21", "title": "WCAG 2.2", "kind": "official-standard", "source": "https://www.w3.org/TR/WCAG22/", "status": "primary" },
    { "id": "P22", "title": "LaunchPad benchmark harness", "kind": "benchmark-requirement", "source": "../scripts/run-benchmark.mjs", "status": "not-proof" },
    { "id": "P23", "title": "Playwright test documentation", "kind": "official-documentation", "source": "https://playwright.dev/docs/test-intro", "status": "primary" },
    { "id": "P24", "title": "axe-core documentation", "kind": "official-documentation", "source": "https://github.com/dequelabs/axe-core", "status": "primary" },
    { "id": "P25", "title": "LaunchPad browser fixture", "kind": "local-test", "source": "../tests/browser/quality.spec.mjs", "status": "reproducible" },
    { "id": "P26", "title": "Playwright rendered behavior documentation", "kind": "official-documentation", "source": "https://playwright.dev/docs/screenshots", "status": "primary" },
    { "id": "P27", "title": "LaunchPad accessibility and browser checks", "kind": "local-test", "source": "../tests/browser/quality.spec.mjs", "status": "reproducible" },
    { "id": "P28", "title": "Anthropic frontend-design skill source", "kind": "official-documentation", "source": "https://github.com/anthropics/skills/blob/main/skills/frontend-design/SKILL.md", "status": "primary" },
    { "id": "P29", "title": "Design Tokens Community Group format report", "kind": "official-standard", "source": "https://www.w3.org/community/reports/design-tokens/CG-FINAL-format-20251028/", "status": "primary" },
    { "id": "P30", "title": "LaunchPad repeated evaluator harness", "kind": "local-test", "source": "../scripts/run-benchmark.mjs", "status": "reproducible" }
  ],
  "sources": [
    { "id": "R01", "url": "https://www.reddit.com/r/ClaudeAI/comments/1s96sae/i_cannot_figure_out_frontend_design_skill/", "title": "I cannot figure out front-end design skill", "subreddit": "r/ClaudeAI", "dateText": "2026-04-01", "postType": "question", "authorClaim": { "summary": "Installed design skills still produced the same container-based AI UI and the author wanted better non-slop output.", "evidenceStatus": "anecdotal", "proofRefs": [] }, "commentThemes": [{ "summary": "Commenters suggested explicit skill invocation, localhost mockups, screenshot iteration, and external visual evaluation.", "stance": "support", "evidenceStatus": "anecdotal", "proofRefs": ["P01"] }, { "summary": "The author had the skill installed but had not realized it might need to be explicitly invoked.", "stance": "challenge", "evidenceStatus": "anecdotal", "proofRefs": [] }], "contradictions": ["The discussion mixes prompt quality, skill activation, reference images, and external evaluators, so it does not isolate a causal fix."], "evidenceQuality": "low", "confidence": "low", "proofRefs": ["P01"], "disposition": "research-only", "implementationDecision": "Do not add a mandatory external evaluator or activation rule from this post alone." },
    { "id": "R02", "url": "https://www.reddit.com/r/ClaudeAI/comments/1ulgm5l/frontend_design_trying_to_move_away_from_the_ai/", "title": "Frontend Design — Trying To Move away from the AI generated GUI", "subreddit": "r/ClaudeAI", "dateText": "2026-07-02", "postType": "question", "authorClaim": { "summary": "The author reported that output drifted back toward recognizable AI GUI patterns despite using wireframes and Anthropic's frontend-design skill.", "evidenceStatus": "anecdotal", "proofRefs": [] }, "commentThemes": [{ "summary": "Suggestions included reference designs, custom design skills, Impeccable, and Design.md-style persistent guidance.", "stance": "mixed", "evidenceStatus": "anecdotal", "proofRefs": ["P02"] }], "contradictions": ["Recommendations disagree on whether the main remedy is a skill, references, or user taste."], "evidenceQuality": "low", "confidence": "low", "proofRefs": ["P02"], "disposition": "research-only", "implementationDecision": "Keep reference ingestion and persistent Design DNA as hypotheses pending controlled comparison." },
    { "id": "R03", "url": "https://www.reddit.com/r/codex/comments/1upt5ha/how_do_you_handle_frontendui_work_with_codex/", "title": "How do you handle frontend/UI work with Codex?", "subreddit": "r/codex", "dateText": "2026-07-07", "postType": "question", "authorClaim": { "summary": "The author asked how to make Codex match an existing UI design consistently.", "evidenceStatus": "anecdotal", "proofRefs": [] }, "commentThemes": [{ "summary": "Replies favored image references, design files, and separating frontend implementation from backend work.", "stance": "support", "evidenceStatus": "anecdotal", "proofRefs": ["P03"] }, { "summary": "A commenter described model reliability and truthfulness issues, weakening confidence in unverified self-assessment.", "stance": "challenge", "evidenceStatus": "anecdotal", "proofRefs": [] }], "contradictions": ["The post asks about consistency, while some replies optimize for visual imitation rather than UX quality."], "evidenceQuality": "low", "confidence": "low", "proofRefs": ["P03"], "disposition": "research-only", "implementationDecision": "Do not equate screenshot similarity with usability or design quality." },